{"$id":"https://locus.invalid/schemas/managed-performance-instrumentation-v2.schema.json","$schema":"https://json-schema.org/draft/2020-12/schema","additionalProperties":false,"properties":{"application_body_roles":{"type":"array"},"clock":{"const":"client-monotonic-nanoseconds"},"end_to_end":{"const":"client-observed"},"excluded_metrics":{"type":"array"},"format_id":{"const":"LOCUS-managed-performance-instrumentation-v2"},"persisted_roles":{"type":"array"},"phase_rule":{"type":"string"},"phases":{"type":"array"},"positive_controls":{"type":"array"},"status":{"const":"assigned"}},"required":["format_id","clock","end_to_end","phase_rule","phases","application_body_roles","persisted_roles","positive_controls","excluded_metrics","status"],"type":"object"}
