{"application_body_roles":["browser","manager-ui","manager-controller","managed-client","admission","operator","storage-gateway","provider","resolver","party-1","party-2","party-3","party-4","party-5","docker-engine"],"clock":"client-monotonic-nanoseconds","end_to_end":"client-observed","excluded_metrics":["browser-rendering","ui-round-trip","lifecycle-latency","concurrency-throughput","successor-latency"],"format_id":"LOCUS-managed-performance-instrumentation-v2","persisted_roles":["admission","bootstrap","managed-client-template","managed-client-instance","manager-controller","manager-ui","operator","party-1","party-2","party-3","party-4","party-5","resolver","provider","s3-role","storage-gateway"],"phase_rule":"fixed-applicable-non-overlapping-and-bounded-by-end-to-end","phases":["policy","resolver","suite-initialization","appss-per-server-initialization","encryption-and-upload","party-provisioning","descriptor-publication-and-retrieval","authorization","recovery"],"positive_controls":["monotonic-clock","phase-nonoverlap","end-to-end-bounds-phases","application-byte-reconciliation","persisted-byte-reconciliation","warmup-precedes-measurement","graph-and-arm-binding","expected-scenario-outcome","failure-schedule-binding","invalid-attempt-linkage","block-checkpoint-binding","prohibited-output-canary","cleanup","raw-to-processed-hash-closure"],"status":"assigned"}
